{
  "diagnostics": [
    {
      "code": "W001",
      "edits": [],
      "help": [],
      "message": "empty file",
      "notes": [],
      "primary": {
        "message": "EOF",
        "span": {
          "end": {
            "byte": 0,
            "column": 1,
            "line": 1
          },
          "file": "empty.tfd",
          "source_id": 0,
          "source_valid": true,
          "start": {
            "byte": 0,
            "column": 1,
            "line": 1
          }
        }
      },
      "secondary": [],
      "severity": "warning"
    },
    {
      "code": "E110",
      "edits": [],
      "help": [],
      "message": "unfinished block",
      "notes": [],
      "primary": {
        "message": "block extends to EOF",
        "span": {
          "end": {
            "byte": 29,
            "column": 5,
            "line": 4
          },
          "file": "src/main.tfd",
          "source_id": 0,
          "source_valid": true,
          "start": {
            "byte": 0,
            "column": 1,
            "line": 1
          }
        }
      },
      "secondary": [],
      "severity": "error"
    },
    {
      "code": "E203",
      "edits": [
        {
          "replacement": "omega",
          "span": {
            "end": {
              "byte": 6,
              "column": 6,
              "line": 1
            },
            "file": "src/main.tfd",
            "source_id": 0,
            "source_valid": true,
            "start": {
              "byte": 4,
              "column": 5,
              "line": 1
            }
          }
        }
      ],
      "help": [
        "use an ASCII identifier"
      ],
      "message": "unresolved name \u03a9",
      "notes": [
        "names are case sensitive"
      ],
      "primary": {
        "message": "unknown binding",
        "span": {
          "end": {
            "byte": 6,
            "column": 6,
            "line": 1
          },
          "file": "src/main.tfd",
          "source_id": 0,
          "source_valid": true,
          "start": {
            "byte": 4,
            "column": 5,
            "line": 1
          }
        }
      },
      "secondary": [
        {
          "message": "overlapping context",
          "span": {
            "end": {
              "byte": 6,
              "column": 6,
              "line": 1
            },
            "file": "src/main.tfd",
            "source_id": 0,
            "source_valid": true,
            "start": {
              "byte": 0,
              "column": 1,
              "line": 1
            }
          }
        },
        {
          "message": "declared here",
          "span": {
            "end": {
              "byte": 5,
              "column": 6,
              "line": 1
            },
            "file": "lib/decl.tfd",
            "source_id": 0,
            "source_valid": true,
            "start": {
              "byte": 1,
              "column": 2,
              "line": 1
            }
          }
        }
      ],
      "severity": "error"
    },
    {
      "code": "E110",
      "edits": [],
      "help": [],
      "message": "missing token",
      "notes": [],
      "primary": {
        "message": "insert here",
        "span": {
          "end": {
            "byte": 29,
            "column": 5,
            "line": 4
          },
          "file": "src/main.tfd",
          "source_id": 0,
          "source_valid": true,
          "start": {
            "byte": 29,
            "column": 5,
            "line": 4
          }
        }
      },
      "secondary": [],
      "severity": "error"
    }
  ],
  "has_errors": true,
  "schema_version": 1,
  "suppressed": []
}
